{"dataset_version":"23d83841b22ab51f02a20505925dfa56b443755bb4437cf1e2418b57783e5c27","dimensions":{"cols":12,"rows":12},"grid":[["E","H","S","T","U","K","O","N","H","N","X","H"],["O","E","F","E","I","I","I","E","U","H","N","K"],["N","A","R","F","E","U","U","I","A","I","Z","P"],["E","I","S","I","J","U","H","M","M","X","U","A"],["E","Y","P","O","G","E","N","U","J","W","N","A"],["U","T","L","O","H","X","S","E","Y","J","E","E"],["R","H","T","K","E","I","O","A","R","N","V","G"],["L","H","A","R","U","N","T","K","A","N","S","I"],["P","J","C","P","A","P","M","I","P","L","Y","N"],["P","A","R","K","S","I","E","U","N","N","O","O"],["A","S","I","U","E","P","S","I","O","H","N","O"],["A","Y","B","I","E","I","S","U","U","E","A","Y"]],"puzzle_id":"17bf75b8e21ce28c60d6d788f413727dff5603e505f44becf0e01368a797ab6d","reference_date":"2026-10-26","schema_version":"kpop-word-search-puzzle-v1","theme":{"en":"Members of STAYC","pt-BR":"Integrantes do grupo STAYC"},"theme_description":{"en":"Documented members of the group STAYC.","pt-BR":"Integrantes documentados do grupo STAYC."},"words":[{"canonical_name":"Isa","end_col":0,"end_row":10,"evidence":[{"fact_base_id":"Q101541493$147a3fab-4768-733e-6ec8-a7597b73423c","locator":"wikipedia:en:pageid=65980370:revid=1381225832#extract[189:192]","revision_id":1381225832,"source_key":"wikipedia:en","source_url":"https://en.wikipedia.org/w/index.php?curid=65980370&oldid=1381225832"}],"id":"Q106518536","labels":{"en":"Isa","pt-BR":"Isa"},"start_col":2,"start_row":10,"word":"ISA"},{"canonical_name":"Park Si-eun","end_col":8,"end_row":9,"evidence":[{"fact_base_id":"Q101541493$dd3ca714-4519-6456-f4c1-a6df633c6c81","locator":"wikipedia:en:pageid=65980370:revid=1381225832#extract[182:187]","revision_id":1381225832,"source_key":"wikipedia:en","source_url":"https://en.wikipedia.org/w/index.php?curid=65980370&oldid=1381225832"}],"id":"Q16180796","labels":{"en":"Park Si-eun","pt-BR":"Park Si-eun"},"start_col":0,"start_row":9,"word":"PARKSIEUN"},{"canonical_name":"Seeun","end_col":6,"end_row":4,"evidence":[{"fact_base_id":"Q101541493$d3fe2e6d-45e7-42db-5226-92b9c779b2dd","locator":"wikipedia:en:pageid=65980370:revid=1381225832#extract[194:199]","revision_id":1381225832,"source_key":"wikipedia:en","source_url":"https://en.wikipedia.org/w/index.php?curid=65980370&oldid=1381225832"}],"id":"Q106518627","labels":{"en":"Seeun","pt-BR":"Seeun"},"start_col":2,"start_row":0,"word":"SEEUN"},{"canonical_name":"Sumin","end_col":10,"end_row":1,"evidence":[{"fact_base_id":"Q101541493$0670a55a-4043-3ca1-fc6a-9711cf370212","locator":"wikipedia:en:pageid=65980370:revid=1381225832#extract[175:180]","revision_id":1381225832,"source_key":"wikipedia:en","source_url":"https://en.wikipedia.org/w/index.php?curid=65980370&oldid=1381225832"}],"id":"Q106518333","labels":{"en":"Sumin","pt-BR":"Sumin"},"start_col":6,"start_row":5,"word":"SUMIN"},{"canonical_name":"Yoon","end_col":11,"end_row":8,"evidence":[{"fact_base_id":"Q101541493$cc5ed527-4ef4-1fd9-6b1f-39c7549fe799","locator":"wikipedia:en:pageid=65980370:revid=1381225832#extract[201:205]","revision_id":1381225832,"source_key":"wikipedia:en","source_url":"https://en.wikipedia.org/w/index.php?curid=65980370&oldid=1381225832"}],"id":"Q106518626","labels":{"en":"Yoon","pt-BR":"Yoon"},"start_col":11,"start_row":11,"word":"YOON"}]}
